Company Name,URL,Address,Phone,Business Type
F K Overseas,https://www.bdtradeinfo.com/company/f-k-overseas-49521,"147, D.I.T Ext. Road (1st Floor), Fakirapool,                                                                                                       Dhaka- 1000,                                                                                                       Bangladesh","+880-2-49350226, 48318734, 8331455, 01819-151049",Travel Agencies (Air Ticketing & others)
F & A Enterprise,https://www.bdtradeinfo.com/company/f-a-enterprise-19001,"80, Motijheel C/A (Ground floor),                                                                                                       Dhaka- 1000,                                                                                                       Bangladesh","+880-2-7161993, 7168865",Contractors
F. F. Garments (pvt) ltd,https://www.bdtradeinfo.com/company/f-f-garments-pvt-ltd-46306,"14/15, R. K. Das Road, Netaigonj,                                                                                                       Narayanganj- 1400,                                                                                                       Bangladesh",+880-2-7631817,Knit Wears Manufacturers & Exporters [ Knit Garments ]
F-8 Fashion & Embroidery,https://www.bdtradeinfo.com/company/f-8-fashion-embroidery-46305,"222, New Elephant Road (2nd Floor),                                                                                                       Dhaka- 1205,                                                                                                       Bangladesh",+88-01711-861885,Knit Wears Manufacturers & Exporters [ Knit Garments ]
F. J. Seafood Trade International Ltd.,https://www.bdtradeinfo.com/company/f-j-seafood-trade-international-ltd-38678,"15/2, Topkhana Road, B.M.A. Bhaban,                                                                                                       Dhaka- 1000,                                                                                                       Bangladesh","+880-2-9571738, 9554015",Medical Equipment
F. R. Trading corporation,https://www.bdtradeinfo.com/company/f-r-trading-corporation-50406,"Room # 209, (8th Floor), Muktobangla Shopping Complex,                                                                                                       Dhaka- 1216,                                                                                                       Bangladesh",+88-01766-008585,Jute Ropes & Cords
F. M. Surgical & Scientific Co.,https://www.bdtradeinfo.com/company/f-m-surgical-scientific-co-30778,"15/2, Topkhana Road, B.M.A. Bhaban,                                                                                                       Dhaka- 1000,                                                                                                       Bangladesh","+880-2-9571738, 9554015",Medical Equipment
F.A.H. Overseas Ltd.,https://www.bdtradeinfo.com/company/fah-overseas-ltd-43571,"Kulsum Apartment, 2nd Floor, 40-41, Sidhawshory Circular Road, Shantinagar,                                                                                                       Dhaka- 1217,                                                                                                       Bangladesh","+88-02-9349839, 01925-529555, 01771-766696",Manpower Recruiting Agency
F.h. International,https://www.bdtradeinfo.com/company/fh-international-45318,"46-48, Dr Kudrat-E-Khuda Road (Elephant Road), Shop # 716, 717, 718, Suvastu Arcade, 7th Floor,                                                                                                       Dhaka- 1205,                                                                                                       Bangladesh",+88-01670-001117,Computer Sales & Distributor
F Rahman Enterprises,https://www.bdtradeinfo.com/company/f-rahman-enterprises-51059,"115/7A, Distillary Road, Gandaria,                                                                                                       Dhaka- 1204,                                                                                                       Bangladesh","+88-02-7443546, 01713-258824",Oil Company & Oil Tanker
F.H. International ltd.,https://www.bdtradeinfo.com/company/fh-international-ltd-39509,"183, Shahid Sayed Nazrul Islam Sarani (3/3C Bijoynagor),                                                                                                       Dhaka- 1000,                                                                                                       Bangladesh","+88-02-9330366, 01713-039045",Garments Accessories Supplier
F. Rahman Oil Mills Ltd.,https://www.bdtradeinfo.com/company/f-rahman-oil-mills-ltd-39366,"115/7A, Distillary Road, Gandaria,                                                                                                       Dhaka- 1204,                                                                                                       Bangladesh","+88-02-7443546, 01713-258824",Oil Company & Oil Tanker
F.F. Foundation Ltd,https://www.bdtradeinfo.com/company/ff-foundation-ltd-27488,"House-74, Road-2, Banani,                                                                                                       Dhaka- 1213,                                                                                                       Bangladesh",+880-2-8828546,Engineering Consultant
F.K. Textile Mills,https://www.bdtradeinfo.com/company/fk-textile-mills-39074,"203/1, Godnail Road Arambagh, L.N.S Mills,                                                                                                       Narayanganj- 1400,                                                                                                       Bangladesh","+88-02-7693347, 01912-011298",Textile Mills
F.l. Garments Accessories Ltd.,https://www.bdtradeinfo.com/company/fl-garments-accessories-ltd-14521,"11/1, Joynag Road (1st floor), Lalbagh,                                                                                                       Dhaka- 1211,                                                                                                       Bangladesh","+880-2-8621646, 9613773, 9670576, 9677372",Garments Accessories Manufacturer
F.L. International Ltd.,https://www.bdtradeinfo.com/company/fl-international-ltd-28767,"House-74, Road-2, Banani,                                                                                                       Dhaka- 1213,                                                                                                       Bangladesh",+880-2-8828546,Engineering Consultant
F.M. Chemicals & Scientific Company,https://www.bdtradeinfo.com/company/fm-chemicals-scientific-company-33189,"05 Topkhana Road,                                                                                                       Dhaka- 1205,                                                                                                       Bangladesh",+88-01714-217213,Medical Disposable Items
F.M. Scientific Co,https://www.bdtradeinfo.com/company/fm-scientific-co-49930,"33/3 Hatkhola Road, Tikatuli,                                                                                                       Dhaka- 1203,                                                                                                       Bangladesh","+880-2-7120195, 9561608, 01678-575959, 01684-239794",Scientific Equipment / Instruments / Products
F.M. Surgical & Scientific,https://www.bdtradeinfo.com/company/fm-surgical-scientific-51975,"05 Topkhana Road,                                                                                                       Dhaka- 1205,                                                                                                       Bangladesh",+88-01714-217213,Medical Disposable Items
F.M. Trade & Co,https://www.bdtradeinfo.com/company/fm-trade-co-36653,"333/1, Tongi Divertion Road (2nd Floor),                                                                                                       Dhaka- 1217,                                                                                                       Bangladesh",+880-2-8312751,Real Estate Agents
F.M.Q. Establishment,https://www.bdtradeinfo.com/company/fmq-establishment-43572,"G-Nat Tower (2nd Floor), 116-117, D.I.T. Extension Road, Fakirapool,                                                                                                       Dhaka- 1000,                                                                                                       Bangladesh","+88-02-7195795, 01199-869019, 01911-355170",Manpower Recruiting Agency
F.R. Traders,https://www.bdtradeinfo.com/company/fr-traders-36181,"2-Darus Salam Road Mirpur # 1,                                                                                                       Dhaka- 1216,                                                                                                       Bangladesh","+880-2-8355160, 7213916, 7214891",Knit Wears Manufacturers & Exporters [ Knit Garments ]
Faanush.com,https://www.bdtradeinfo.com/company/faanushcom-38116,"1/1, Shukrabad Mirpur Road,                                                                                                       Dhaka,                                                                                                       Bangladesh",+88-01721-324456,"Web Design, developing & domain-hosting company"
Faatehstyle Wear Ltd.,https://www.bdtradeinfo.com/company/faatehstyle-wear-ltd-46307,"2-Darus Salam Road Mirpur # 1,                                                                                                       Dhaka- 1216,                                                                                                       Bangladesh","+880-2-8355160, 7213916, 7214891",Knit Wears Manufacturers & Exporters [ Knit Garments ]
FAAZ Universal Network,https://www.bdtradeinfo.com/company/faaz-universal-network-46059,"Hariharpara, Panchabati, Fatullah,                                                                                                       Narayanganj- 1400,                                                                                                       Bangladesh",+880-2-7670519,Knit Wears Manufacturers & Exporters [ Knit Garments ]
Fabian Group,https://www.bdtradeinfo.com/company/fabian-group-27038,"159/D, Kunipara, Tejgaon I/A,                                                                                                       Dhaka- 1208,                                                                                                       Bangladesh",+88-02-8870635-40,Zipper Manufacturers & Distributors
Fabin Apparels Ltd,https://www.bdtradeinfo.com/company/fabin-apparels-ltd-46308,"Hariharpara, Panchabati, Fatullah,                                                                                                       Narayanganj- 1400,                                                                                                       Bangladesh",+880-2-7670519,Knit Wears Manufacturers & Exporters [ Knit Garments ]
Fabitex (Pvt) Ltd.,https://www.bdtradeinfo.com/company/fabitex-pvt-ltd-46309,"167 No. Shashongaon, Enayetnagar, Fatullah,                                                                                                       Narayanganj- 1400,                                                                                                       Bangladesh",+880-2-7670591,Knit Wears Manufacturers & Exporters [ Knit Garments ]
Fabian Thread Ltd.,https://www.bdtradeinfo.com/company/fabian-thread-ltd-30025,"Plot # 53, Sector-1,                                                                                                       Chittagong,                                                                                                       Bangladesh","+880-31-616255, 624249",Companies of EPZ
Fabrics view,https://www.bdtradeinfo.com/company/fabrics-view-26585,"B-61, Shopping Center, Glishan-1 (Ground floor),                                                                                                       Dhaka- 1212,                                                                                                       Bangladesh",+880-2-8819370,Curtains
Fabritex Attires Ltd.,https://www.bdtradeinfo.com/company/fabritex-attires-ltd-46310,"167 No. Shashongaon, Enayetnagar, Fatullah,                                                                                                       Narayanganj- 1400,                                                                                                       Bangladesh",+880-2-7670591,Knit Wears Manufacturers & Exporters [ Knit Garments ]
Fabtex Ltd,https://www.bdtradeinfo.com/company/fabtex-ltd-17631,"Plot # 53, Sector-1,                                                                                                       Chittagong,                                                                                                       Bangladesh","+880-31-616255, 624249",Companies of EPZ
Facilities Concern,https://www.bdtradeinfo.com/company/facilities-concern-43573,"Facilities Tower, 13th Floor, Kha-199/2, Middle Badda,                                                                                                       Dhaka- 1212,                                                                                                       Bangladesh","+88-02-9858355, 8826505, 8321094, 58311043, 01711-538404",Manpower Recruiting Agency
Fahad Autos,https://www.bdtradeinfo.com/company/fahad-autos-32227,"95, New Eskaton Road, Helena Centre (1st floor),                                                                                                       Dhaka- 1000,                                                                                                       Bangladesh","+880-2-9337281, 01917-793969",Motorcycle Parts & Accessories
Factura Softwares,https://www.bdtradeinfo.com/company/factura-softwares-47860,"A/17, Imperial Super Market, 105/106, Nawabpur Road,                                                                                                       Dhaka- 1100,                                                                                                       Bangladesh","+880-2-7120257, 01931-403267",Bearing
Fahad Filling Station,https://www.bdtradeinfo.com/company/fahad-filling-station-39669,"Eden Building, 167, Inner Circular Road, Motijheel C/A,                                                                                                       Dhaka- 1000,                                                                                                       Bangladesh","+880-2-7102039, 01711-530967",Diagnostic Centers
Fahad Enterprise,https://www.bdtradeinfo.com/company/fahad-enterprise-28745,"A/17, Imperial Super Market, 105/106, Nawabpur Road,                                                                                                       Dhaka- 1100,                                                                                                       Bangladesh","+880-2-7120257, 01931-403267",Bearing
Fahad International,https://www.bdtradeinfo.com/company/fahad-international-43574,"Shotabdi Centre, 3/D, 3rd Floor, 292, Inner Circular Road, Fakirapool,                                                                                                       Dhaka- 1000,                                                                                                       Bangladesh","+88-02-7191132, 7191133, 	01713-002330",Manpower Recruiting Agency
Fahad Medical & Diagnostic Centre Ltd.,https://www.bdtradeinfo.com/company/fahad-medical-diagnostic-centre-ltd-29751,"Eden Building, 167, Inner Circular Road, Motijheel C/A,                                                                                                       Dhaka- 1000,                                                                                                       Bangladesh","+880-2-7102039, 01711-530967",Diagnostic Centers
Fahad Optics,https://www.bdtradeinfo.com/company/fahad-optics-44379,"5 Baitul Mukarram (1st floor),                                                                                                       Dhaka- 1000,                                                                                                       Bangladesh",+880-2-9555829,Jewelry (Gold / Diamond)
Fahim Airways,https://www.bdtradeinfo.com/company/fahim-airways-41926,"17/2, Topkhana Road ,Shop # 2, Gafur Tower (Ground Floor),                                                                                                       Dhaka- 1000,                                                                                                       Bangladesh",+88-01716-248234,Medical Disposable Items
Fahim Jewellers,https://www.bdtradeinfo.com/company/fahim-jewellers-22324,"5 Baitul Mukarram (1st floor),                                                                                                       Dhaka- 1000,                                                                                                       Bangladesh",+880-2-9555829,Jewelry (Gold / Diamond)
FAHIM SURGICAL,https://www.bdtradeinfo.com/company/fahim-surgical-49948,"17/2, Topkhana Road ,Shop # 2, Gafur Tower (Ground Floor),                                                                                                       Dhaka- 1000,                                                                                                       Bangladesh",+88-01716-248234,Medical Disposable Items
Fahim Brothers,https://www.bdtradeinfo.com/company/fahim-brothers-21081,"Al-raji Complex, Room No. 301, 3rd Floor, Shahid Syed Nazrul Islam Sarani, Purana Paltan,                                                                                                       Dhaka- 1000,                                                                                                       Bangladesh","+880-2-55111599, 55111699, 01739-400276",Travel Agencies (Air Ticketing & others)
Fahim Textile Mills Ltd.,https://www.bdtradeinfo.com/company/fahim-textile-mills-ltd-34346,"145, Shantinagar, Eastern plus (7th floor), Suite # 7/1-4,                                                                                                       Dhaka- 1217,                                                                                                       Bangladesh",+880-2-8363772-3,Textile Mills
Fahim Travels & Tours,https://www.bdtradeinfo.com/company/fahim-travels-tours-47802,"Al-raji Complex, Room No. 301, 3rd Floor, Shahid Syed Nazrul Islam Sarani, Purana Paltan,                                                                                                       Dhaka- 1000,                                                                                                       Bangladesh","+880-2-55111599, 55111699, 01739-400276",Travel Agencies (Air Ticketing & others)
Fahim Travels International,https://www.bdtradeinfo.com/company/fahim-travels-international-43575,"9/43, Eastern Plaza (8th floor), 22/7, Sonargaon Road, Hatirpool,                                                                                                       Dhaka- 1205,                                                                                                       Bangladesh","+880-2-8620835, 8618013",Cosmetics & Beauty Products
Fahima Travels International,https://www.bdtradeinfo.com/company/fahima-travels-international-50035,"15, Sutar Noardha (2nd Floor), Arapara, Savar,                                                                                                       Dhaka- 1340,                                                                                                       Bangladesh",+880-2-8014235,Knit Wears Manufacturers & Exporters [ Knit Garments ]
Fair & Fame Knit Fabrics Ltd.,https://www.bdtradeinfo.com/company/fair-fame-knit-fabrics-ltd-46311,"House-39, Road-37, Flat-A (1st Floor) Gulshan-2,                                                                                                       Dhaka- 1212,                                                                                                       Bangladesh","+880-2-7421533, 7416365, 01711-537049",Knit Wears Manufacturers & Exporters [ Knit Garments ]
Faim Water & Cometic Co. Ltd.,https://www.bdtradeinfo.com/company/faim-water-cometic-co-ltd-31459,"9/43, Eastern Plaza (8th floor), 22/7, Sonargaon Road, Hatirpool,                                                                                                       Dhaka- 1205,                                                                                                       Bangladesh","+880-2-8620835, 8618013",Cosmetics & Beauty Products
Fair Apparels (Bd),https://www.bdtradeinfo.com/company/fair-apparels-bd-46312,"15, Sutar Noardha (2nd Floor), Arapara, Savar,                                                                                                       Dhaka- 1340,                                                                                                       Bangladesh",+880-2-8014235,Knit Wears Manufacturers & Exporters [ Knit Garments ]
Fair Apparels Ltd.,https://www.bdtradeinfo.com/company/fair-apparels-ltd-46313,"43/45, DCC Market (1st floor), Gulshan 2nd Circule,                                                                                                       Dhaka- 1212,                                                                                                       Bangladesh","+880-2-8821050, 9884824",Cable TV Network
Fair Associates,https://www.bdtradeinfo.com/company/fair-associates-39680,"3/6, Asad Avenue (3rd Floor), Mohammadpur,                                                                                                       Dhaka- 1207,                                                                                                       Bangladesh","+880-2-7710905, 7712454, 7742967-68",Knit Wears Manufacturers & Exporters [ Knit Garments ]
Fair Cable Connection,https://www.bdtradeinfo.com/company/fair-cable-connection-48282,"43/45, DCC Market (1st floor), Gulshan 2nd Circule,                                                                                                       Dhaka- 1212,                                                                                                       Bangladesh","+880-2-8821050, 9884824",Cable TV Network
Fair Clothings (Pvt) Ltd.,https://www.bdtradeinfo.com/company/fair-clothings-pvt-ltd-46314,"3/6, Asad Avenue (3rd Floor), Mohammadpur,                                                                                                       Dhaka- 1207,                                                                                                       Bangladesh","+880-2-7710905, 7712454, 7742967-68",Knit Wears Manufacturers & Exporters [ Knit Garments ]
Fair Composite Designers,https://www.bdtradeinfo.com/company/fair-composite-designers-46315,"Ellal Chamber 11 Motijheel C/A, (7th floor),                                                                                                       Dhaka- 1000,                                                                                                       Bangladesh",+88-01730-427373,Cotton Suppliers
Fair Cotton,https://www.bdtradeinfo.com/company/fair-cotton-51131,"Ellal Chamber 11 Motijheel C/A, (7th floor),                                                                                                       Dhaka- 1000,                                                                                                       Bangladesh",+88-01730-427373,Cotton Suppliers
Fair Composite Designers Ltd,https://www.bdtradeinfo.com/company/fair-composite-designers-ltd-46316,"Khawaja Palace House # 76/B (2nd & 3rd floor), Road # 11,                                                                                                       Dhaka- 1213,                                                                                                       Bangladesh","+88-02-8818147-50, 01713-229890, 01871-005500",Mobile Telephone Set Dealers & Sellers
Fair Distribution Limited,https://www.bdtradeinfo.com/company/fair-distribution-limited-39380,"Khawaja Palace House # 76/B (2nd & 3rd floor), Road # 11,                                                                                                       Dhaka- 1213,                                                                                                       Bangladesh","+88-02-8818147-50, 01713-229890, 01871-005500",Mobile Telephone Set Dealers & Sellers
Fair Deal Enterprise,https://www.bdtradeinfo.com/company/fair-deal-enterprise-38013,"15, Sutar Noardha, Arapara, Savar,                                                                                                       Dhaka- 1340,                                                                                                       Bangladesh","+880-2-7710905, 7712454, 91228810, 8116473, 8114729",Knit Wears Manufacturers & Exporters [ Knit Garments ]
Fair Dental & Medical Care,https://www.bdtradeinfo.com/company/fair-dental-medical-care-50696,"Rahman Chamber ( 8th Floor) 12-13, Motijheel C/A,                                                                                                       Dhaka- 1000,                                                                                                       Bangladesh","+880-2-9666246, 9557773",Tailors
