Company Name,URL,Address,Phone,Business Type
Feather Touch Knittex Styles Ltd.,https://www.bdtradeinfo.com/company/feather-touch-knittex-styles-ltd-46353,"62/3 Purana Paltan Lane, Kakrail,                                                                                                       Dhaka- 1000,                                                                                                       Bangladesh","+880-2-9338196, 9348045","Exporter, Importer & Indentor (Multi Products)"
Feaz Trading,https://www.bdtradeinfo.com/company/feaz-trading-25463,"62/3 Purana Paltan Lane, Kakrail,                                                                                                       Dhaka- 1000,                                                                                                       Bangladesh","+880-2-9338196, 9348045","Exporter, Importer & Indentor (Multi Products)"
Featherlife Ltd.,https://www.bdtradeinfo.com/company/featherlife-ltd-46354,"Suite No # 2001, Floor No # 20, Sena-Kalyan Bhaban, 195 Motijheel C/A,                                                                                                       Dhaka- 1000,                                                                                                       Bangladesh","+880-2-7162939, 7162938, 9552809, 9557939, 7702609, 7702610",Knit Wears Manufacturers & Exporters [ Knit Garments ]
Federal Inspection Services Ltd.,https://www.bdtradeinfo.com/company/federal-inspection-services-ltd-16223,"Navana D.H. Tower (6th Floor), 6, Panthapath,                                                                                                       Dhaka- 1215,                                                                                                       Bangladesh",+880-2-223374054-55,Insurance Companies (General)
Federal Insurance Company Ltd.,https://www.bdtradeinfo.com/company/federal-insurance-company-ltd-15465,"Navana D.H. Tower (6th Floor), 6, Panthapath,                                                                                                       Dhaka- 1215,                                                                                                       Bangladesh",+880-2-223374054-55,Insurance Companies (General)
Federal Insurance C. Ltd,https://www.bdtradeinfo.com/company/federal-insurance-c-ltd-27951,"20, Link Road, Bangla Motor,                                                                                                       Dhaka- 1000,                                                                                                       Bangladesh",+880-2-8613097-8,Hospital
Federal Medical College Hospital Ltd,https://www.bdtradeinfo.com/company/federal-medical-college-hospital-ltd-46164,"20, Link Road, Bangla Motor,                                                                                                       Dhaka- 1000,                                                                                                       Bangladesh",+880-2-8613097-8,Hospital
Federal Securities And Investment Limited.,https://www.bdtradeinfo.com/company/federal-securities-and-investment-limited-44630,"Navana Tower (9th floor), Plot # 45, Flat # D, Gulshan South Avenue, Gulshan - 01,                                                                                                       Dhaka- 1212,                                                                                                       Bangladesh","+880-2-8815586-7, 8820404, 8822273-207, 7169086, 01713-000080",Share & Security Broker House
Federal Money Changer Ltd.,https://www.bdtradeinfo.com/company/federal-money-changer-ltd-31338,"177, Shaheed Sayed Nazrul Islam Sarani,                                                                                                       Dhaka- 1000,                                                                                                       Bangladesh",+88-01911-385173,Manpower Recruiting Agency
Federal Trading Corporation Ltd.,https://www.bdtradeinfo.com/company/federal-trading-corporation-ltd-19383,"177, Shaheed Sayed Nazrul Islam Sarani,                                                                                                       Dhaka- 1000,                                                                                                       Bangladesh",+88-01911-385173,Manpower Recruiting Agency
Federation De Camaras De Comercio E Industria De Panama (Fedecamaras),https://www.bdtradeinfo.com/company/federation-de-camaras-de-comercio-e-industria-de-panama-fedecamaras-17889,"29, Gregory's Road,                                                                                                       Colombo,                                                                                                       SRILANKA",(941) 698225,International Chamber of Commerce
Federation of egyptian Chambers of Commerce,https://www.bdtradeinfo.com/company/federation-of-egyptian-chambers-of-commerce-17783,"Federation House Tansen Marg,                                                                                                       New Delhi 110001,                                                                                                       INDIA",(9111) 3738760,International Chamber of Commerce
Federation of Indian Chamber of Commerce and Industry (FICCI),https://www.bdtradeinfo.com/company/federation-of-indian-chamber-of-commerce-and-industry-ficci-17871,"Federation House Tansen Marg,                                                                                                       New Delhi 110001,                                                                                                       INDIA",(9111) 3738760,International Chamber of Commerce
Federation of Chamber of Commerce and Industry of Sri Lanka,https://www.bdtradeinfo.com/company/federation-of-chamber-of-commerce-and-industry-of-sri-lanka-17917,"29, Gregory's Road,                                                                                                       Colombo,                                                                                                       SRILANKA",(941) 698225,International Chamber of Commerce
Federation of Iraqi Chamber of Commerce,https://www.bdtradeinfo.com/company/federation-of-iraqi-chamber-of-commerce-17846,"Mustansir Street P.O. Box 5665,                                                                                                       Baghdad,                                                                                                       IRAQ",(9641) 8876211,International Chamber of Commerce
Federation of Israeli Chambers of Commerce,https://www.bdtradeinfo.com/company/federation-of-israeli-chambers-of-commerce-17861,"Information & Doc. Section P.O. Box 7029, Shemeisani,                                                                                                       Amman 11118,                                                                                                       JORDAN",(9626) 5665492,International Chamber of Commerce
Federation of Jordamian Chamber of Commerce,https://www.bdtradeinfo.com/company/federation-of-jordamian-chamber-of-commerce-17866,"Information & Doc. Section P.O. Box 7029, Shemeisani,                                                                                                       Amman 11118,                                                                                                       JORDAN",(9626) 5665492,International Chamber of Commerce
Federation of Nepalese Chambers of Commerce & Industry (FNCCI),https://www.bdtradeinfo.com/company/federation-of-nepalese-chambers-of-commerce-industry-fncci-17842,"Mousa Ben Nousair Street P.O. Box 5909,                                                                                                       Damascus,                                                                                                       SYRIA",(96311) 3311756,International Chamber of Commerce
Federation of UAE Chamber of Commerce and Industry,https://www.bdtradeinfo.com/company/federation-of-uae-chamber-of-commerce-and-industry-17900,"Corniche street P.O. Box 3014,                                                                                                       Abu Dhabi,                                                                                                       UNITED ARAB EMIRATES",(9712) 214144,International Chamber of Commerce
Federation of Syrian Chambers of Commerce,https://www.bdtradeinfo.com/company/federation-of-syrian-chambers-of-commerce-17910,"Mousa Ben Nousair Street P.O. Box 5909,                                                                                                       Damascus,                                                                                                       SYRIA",(96311) 3311756,International Chamber of Commerce
Federation of Yemen Chamber of Commerce and Industry,https://www.bdtradeinfo.com/company/federation-of-yemen-chamber-of-commerce-and-industry-17799,"Mega Domicile, Plot # 91, Flat # B-6, Road # 04, Block # B, Niketan, Gulshan-1,                                                                                                       Dhaka- 1212,                                                                                                       Bangladesh","+88-01782-887056, 01916-209484",Associations
Feed Industries Association of Bangladesh,https://www.bdtradeinfo.com/company/feed-industries-association-of-bangladesh-41544,"Mega Domicile, Plot # 91, Flat # B-6, Road # 04, Block # B, Niketan, Gulshan-1,                                                                                                       Dhaka- 1212,                                                                                                       Bangladesh","+88-01782-887056, 01916-209484",Associations
Fema International,https://www.bdtradeinfo.com/company/fema-international-18905,"SSK Road, Somobay Super Market (1st Floor), Feni Sadar,                                                                                                       Feni- 3900,                                                                                                       Bangladesh",+88-01722-550778,Cyber Cafe
FEM Accessories Limited,https://www.bdtradeinfo.com/company/fem-accessories-limited-17609,"7/6, Shahid Muktijudda Fariq Iqbal & Toslima Road, D.I.T Road, Malibagh,                                                                                                       Dhaka- 1217,                                                                                                       Bangladesh","+88-02-58313693, 01918-161658",Medicine Stores
Feni Trade Center,https://www.bdtradeinfo.com/company/feni-trade-center-39859,"19, S S Shelina Parvin Road, Wireless Morh, Moghbazar,                                                                                                       Dhaka- 1219,                                                                                                       Bangladesh","+88-01922-662999, 01918-694999, 01717-050928","Computer Products, Accessories, Parts & Services"
Feni Cyber Cafe,https://www.bdtradeinfo.com/company/feni-cyber-cafe-43233,"SSK Road, Somobay Super Market (1st Floor), Feni Sadar,                                                                                                       Feni- 3900,                                                                                                       Bangladesh",+88-01722-550778,Cyber Cafe
Feni Pharmacy,https://www.bdtradeinfo.com/company/feni-pharmacy-38217,"7/6, Shahid Muktijudda Fariq Iqbal & Toslima Road, D.I.T Road, Malibagh,                                                                                                       Dhaka- 1217,                                                                                                       Bangladesh","+88-02-58313693, 01918-161658",Medicine Stores
Ferdaus Overseas,https://www.bdtradeinfo.com/company/ferdaus-overseas-43588,"Flat-11/A, Confidence Tower 5Kha, Sat Masjid Road,                                                                                                       Dhaka- 1207,                                                                                                       Bangladesh","+88-02-9123664, 58152816, 01713-017705, 01838-420421",Agro Products
Ferdous & Lexicons,https://www.bdtradeinfo.com/company/ferdous-lexicons-40289,"Al-Razi Complex (8th floor), Suite D 805, 166-167, Shaheed Syed Nazrul Islam Sharoni Purana Paltan,                                                                                                       Dhaka- 1000,                                                                                                       Bangladesh","+88-01711-081854, 01790-129811",Lawyers
Ferdous Biotech (Pvt.) Ltd.,https://www.bdtradeinfo.com/company/ferdous-biotech-pvt-ltd-40165,"Flat-11/A, Confidence Tower 5Kha, Sat Masjid Road,                                                                                                       Dhaka- 1207,                                                                                                       Bangladesh","+88-02-9123664, 58152816, 01713-017705, 01838-420421",Agro Products
Fera Tech Ltd.,https://www.bdtradeinfo.com/company/fera-tech-ltd-45323,"161/2, Bangshal Road Bangshal,                                                                                                       Dhaka- 1100,                                                                                                       Bangladesh","+88-02-8332761, 01911-322735, 01618-222222","Motorcycle Manufacturers, Assemblers, Distributors & Suppliers"
Ferdaus Ahmed,https://www.bdtradeinfo.com/company/ferdaus-ahmed-39375,"161/2, Bangshal Road Bangshal,                                                                                                       Dhaka- 1100,                                                                                                       Bangladesh","+88-02-8332761, 01911-322735, 01618-222222","Motorcycle Manufacturers, Assemblers, Distributors & Suppliers"
Ferdous Tailors Fabrics Fashions,https://www.bdtradeinfo.com/company/ferdous-tailors-fabrics-fashions-20928,"172, B. B. Road,                                                                                                       Narayanganj- 1400,                                                                                                       Bangladesh","+880-2-9752425, 7641110",Knit Wears Manufacturers & Exporters [ Knit Garments ]
Feroz Knitting Mills (Pvt) Ltd,https://www.bdtradeinfo.com/company/feroz-knitting-mills-pvt-ltd-46355,"172, B. B. Road,                                                                                                       Narayanganj- 1400,                                                                                                       Bangladesh","+880-2-9752425, 7641110",Knit Wears Manufacturers & Exporters [ Knit Garments ]
Feroza Bashar Ideal School & College,https://www.bdtradeinfo.com/company/feroza-bashar-ideal-school-college-42777,"House # 05, Road # 10,(2nd&3rd Floor), Sector # 01, Uttara,                                                                                                       Dhaka- 1230,                                                                                                       Bangladesh",+880-2-7791253,Knit Wears Manufacturers & Exporters [ Knit Garments ]
FFF ENTERPRISE,https://www.bdtradeinfo.com/company/fff-enterprise-50192,"403, Bangabandhu Stadium Super Market,                                                                                                       Dhaka- 1000,                                                                                                       Bangladesh",+8801936-446693,Undefined
Fgs Knitwear Ltd,https://www.bdtradeinfo.com/company/fgs-knitwear-ltd-46356,"House # 05, Road # 10,(2nd&3rd Floor), Sector # 01, Uttara,                                                                                                       Dhaka- 1230,                                                                                                       Bangladesh",+880-2-7791253,Knit Wears Manufacturers & Exporters [ Knit Garments ]
Feza Limited,https://www.bdtradeinfo.com/company/feza-limited-23677,"H# 58, Road : 19, Sector # 11, Uttara,                                                                                                       Dhaka- 1230,                                                                                                       Bangladesh",+88-01717-272595,Garments Buyers / Buying House
Fiber Fashion Limited,https://www.bdtradeinfo.com/company/fiber-fashion-limited-50424,"H# 58, Road : 19, Sector # 11, Uttara,                                                                                                       Dhaka- 1230,                                                                                                       Bangladesh",+88-01717-272595,Garments Buyers / Buying House
Fiber Home Ltd.,https://www.bdtradeinfo.com/company/fiber-home-ltd-43075,"House # 7/B, Road # 13 Gulshan-1,                                                                                                       Dhaka- 1212,                                                                                                       Bangladesh","+88-02-8814615-6, 8814868, 01713-403113",Call Center & Outsourcing
Fiber Garden Ltd.,https://www.bdtradeinfo.com/company/fiber-garden-ltd-46357,"Planners Tower, Room 14 (15th Floor), 13/A, Sonargaon Road,                                                                                                       Dhaka- 1000,                                                                                                       Bangladesh","+88-02-8653512, 9612790, 01713-336272",Jute Fiber
Fiber n Fiber,https://www.bdtradeinfo.com/company/fiber-n-fiber-42070,"Planners Tower, Room 14 (15th Floor), 13/A, Sonargaon Road,                                                                                                       Dhaka- 1000,                                                                                                       Bangladesh","+88-02-8653512, 9612790, 01713-336272",Jute Fiber
Fibers International Ltd,https://www.bdtradeinfo.com/company/fibers-international-ltd-36177,"392, New Eskaton Road,                                                                                                       Dhaka- 1000,                                                                                                       Bangladesh","+880-2-8311473, 01713-035268",Jute Goods Exporters
Fibre Deals Ltd.,https://www.bdtradeinfo.com/company/fibre-deals-ltd-39103,"392, New Eskaton Road,                                                                                                       Dhaka- 1000,                                                                                                       Bangladesh","+880-2-8311473, 01713-035268",Jute Goods Exporters
Fibres International Ltd.,https://www.bdtradeinfo.com/company/fibres-international-ltd-39102,"25-27 Kazi Nazrul Islam Avenue, 4th Floor, Room # 5/E7, Happy Rahman Plaza,                                                                                                       Dhaka- 1000,                                                                                                       Bangladesh",+88-01914-881 217,Jute Goods Exporters
Fibretex Bangladesh,https://www.bdtradeinfo.com/company/fibretex-bangladesh-50381,"25-27 Kazi Nazrul Islam Avenue, 4th Floor, Room # 5/E7, Happy Rahman Plaza,                                                                                                       Dhaka- 1000,                                                                                                       Bangladesh",+88-01914-881 217,Jute Goods Exporters
FICL Group,https://www.bdtradeinfo.com/company/ficl-group-29483,"56, Purana paltan,                                                                                                       Dhaka- 1000,                                                                                                       Bangladesh","+880-2-9556451, 9558425",Electrical Goods Dealers & Sellers
Fichtner Consulting Engineers Ltd,https://www.bdtradeinfo.com/company/fichtner-consulting-engineers-ltd-42257,"Software Technology Park Janata Tower, 9th floor, Kawran Bazar,                                                                                                       Dhaka- 1212,                                                                                                       Bangladesh","+88-02-8835494, 01927-111000",Call Center & Outsourcing
FIFO Tech,https://www.bdtradeinfo.com/company/fifo-tech-41768,"Software Technology Park Janata Tower, 9th floor, Kawran Bazar,                                                                                                       Dhaka- 1212,                                                                                                       Bangladesh","+88-02-8835494, 01927-111000",Call Center & Outsourcing
Fiha Tour & Travels,https://www.bdtradeinfo.com/company/fiha-tour-travels-47578,"P.O. Box14803,                                                                                                       Suva,                                                                                                       FIJI",(679) 314040,International Chamber of Commerce
Filco Sports,https://www.bdtradeinfo.com/company/filco-sports-29113,"18, Maulana Bhasani Stadium Market,                                                                                                       Dhaka- 1000,                                                                                                       Bangladesh",+880-2-9565708,Sports Goods
Film Fair Video,https://www.bdtradeinfo.com/company/film-fair-video-26477,"Sayeednagor, East Noorerchala, Vatara, Dhaka,                                                                                                       Dhaka- 1212,                                                                                                       Bangladesh","+8801718069869, 01304468320, 01871304057",Oil Filter / Fuel Filter
Fiji Chamber of Commerce and Industry,https://www.bdtradeinfo.com/company/fiji-chamber-of-commerce-and-industry-17788,"P.O. Box14803,                                                                                                       Suva,                                                                                                       FIJI",(679) 314040,International Chamber of Commerce
FILTECH Air Filtration,https://www.bdtradeinfo.com/company/filtech-air-filtration-50708,"Sayeednagor, East Noorerchala, Vatara, Dhaka,                                                                                                       Dhaka- 1212,                                                                                                       Bangladesh","+8801718069869, 01304468320, 01871304057",Oil Filter / Fuel Filter
Fimu Flexi Pack Ltd.,https://www.bdtradeinfo.com/company/fimu-flexi-pack-ltd-50922,"House No. 43, 1st Floor, Road No. 27, Block A,                                                                                                       Dhaka- 1213,                                                                                                       Bangladesh","+88-02-8837774, 9880172, 01811-429507, 01768-961533",Manpower Recruiting Agency
Financial Express,https://www.bdtradeinfo.com/company/financial-express-18832,"62/1 Purana Paltan (4th floor),                                                                                                       Dhaka- 1000,                                                                                                       Bangladesh","+880-2-9558318, 9558319",News Agency
Fine Dot Ltd,https://www.bdtradeinfo.com/company/fine-dot-ltd-24294,"Sultan Plaza (1st Floor), 32, Purana Paltan,                                                                                                       Dhaka- 1000,                                                                                                       Bangladesh","+880-2-9570698, 9559133, 01712-067784","Printing, Pre-Press, Post Press Machinery & Equipment"
Finance Overseas Ltd.,https://www.bdtradeinfo.com/company/finance-overseas-ltd-43589,"House No. 43, 1st Floor, Road No. 27, Block A,                                                                                                       Dhaka- 1213,                                                                                                       Bangladesh","+88-02-8837774, 9880172, 01811-429507, 01768-961533",Manpower Recruiting Agency
Financial News Services,https://www.bdtradeinfo.com/company/financial-news-services-23072,"62/1 Purana Paltan (4th floor),                                                                                                       Dhaka- 1000,                                                                                                       Bangladesh","+880-2-9558318, 9558319",News Agency
Fineway Food & Beverage Ltd.,https://www.bdtradeinfo.com/company/fineway-food-beverage-ltd-31307,"City Heart Building Suite # 7/1 (6th floor), 67, Naya Paltan,                                                                                                       Dhaka- 1000,                                                                                                       Bangladesh","+880-2-9346498, 9340394",Food Products
